{
  "edges": [
    {
      "from": "surface:element:passkey-lab",
      "source": {
        "end": 423,
        "line": 423,
        "path": "components/passkey-lab/passkey-lab.js",
        "sha256": "bed9b6d3773cd4d203a5b1776e7d6c64162d1dd121b0272af36633ec8b9fadc1"
      },
      "to": "class:components/passkey-lab/passkey-lab.js:PasskeyLab",
      "verb": "handled_by"
    },
    {
      "from": "surface:element:proto-app",
      "source": {
        "end": 408,
        "line": 408,
        "path": "components/proto-app/proto-app.js",
        "sha256": "3398db312ca043b4ea59df5d5f74e44c514fc35efc4c870a4154ed47aa9f19f3"
      },
      "to": "class:components/proto-app/proto-app.js:ProtoApp",
      "verb": "handled_by"
    },
    {
      "from": "surface:element:proto-base",
      "source": {
        "end": 277,
        "line": 277,
        "path": "components/proto-base/proto-base.js",
        "sha256": "4428b80153eb2d0fafe2864839d0017bbe26a34aae54c53fa391ea800112bcab"
      },
      "to": "class:components/proto-base/proto-base.js:ProtoBase",
      "verb": "handled_by"
    },
    {
      "from": "surface:element:proto-column",
      "source": {
        "end": 208,
        "line": 208,
        "path": "components/proto-column/proto-column.js",
        "sha256": "124dc7184cc42f161a39f84738a3f0ce4e8b47aed7c971b14d429a973216189a"
      },
      "to": "class:components/proto-column/proto-column.js:ProtoColumn",
      "verb": "handled_by"
    },
    {
      "from": "surface:element:reader-chat",
      "source": {
        "end": 278,
        "line": 278,
        "path": "components/reader-chat/reader-chat.js",
        "sha256": "bce9c4afec038fd98bc4a174c0867859a97a3cfbbba242a971f2b70c0834ee85"
      },
      "to": "class:components/reader-chat/reader-chat.js:ReaderChat",
      "verb": "handled_by"
    },
    {
      "from": "surface:element:reader-log",
      "source": {
        "end": 258,
        "line": 258,
        "path": "components/reader-log/reader-log.js",
        "sha256": "64d713c3da7e8a0a07f25400aba6352a54fc5b6b3c173f1144e58a0d91eef8f3"
      },
      "to": "class:components/reader-log/reader-log.js:ReaderLog",
      "verb": "handled_by"
    },
    {
      "from": "surface:element:reader-panel",
      "source": {
        "end": 145,
        "line": 145,
        "path": "components/reader-panel/reader-panel.js",
        "sha256": "a48b5414fb144091c84774b3ced19746b53b61fc9dd3c1059b41a23f6920dd18"
      },
      "to": "class:components/reader-panel/reader-panel.js:ReaderPanel",
      "verb": "handled_by"
    },
    {
      "from": "surface:element:review-base",
      "source": {
        "end": 401,
        "line": 401,
        "path": "review/ui/components/review-base/review-base.js",
        "sha256": "54490c1595f64807eababaea33d238204b922fd648f9e5714ac486e61152f209"
      },
      "to": "class:review/ui/components/review-base/review-base.js:ReviewBase",
      "verb": "handled_by"
    },
    {
      "from": "surface:element:review-brief",
      "source": {
        "end": 123,
        "line": 123,
        "path": "review/ui/components/review-brief/review-brief.js",
        "sha256": "f069bde14a8306e5e6c59aa57d1c23c36cc3af08a93f4b98e22c449b22cf4dc1"
      },
      "to": "class:review/ui/components/review-brief/review-brief.js:ReviewBrief",
      "verb": "handled_by"
    },
    {
      "from": "surface:element:review-code",
      "source": {
        "end": 203,
        "line": 203,
        "path": "review/ui/components/review-code/review-code.js",
        "sha256": "451c7fd1419267b4ba40f58f8027cf9b556e6ffeb4ce52c9d589152549870eae"
      },
      "to": "class:review/ui/components/review-code/review-code.js:ReviewCode",
      "verb": "handled_by"
    },
    {
      "from": "surface:element:review-crumb",
      "source": {
        "end": 51,
        "line": 51,
        "path": "review/ui/components/review-crumb/review-crumb.js",
        "sha256": "483e313966431184a86815aa927177bae7a5aa7330358781efa089620594d8f3"
      },
      "to": "class:review/ui/components/review-crumb/review-crumb.js:ReviewCrumb",
      "verb": "handled_by"
    },
    {
      "from": "surface:element:review-graph",
      "source": {
        "end": 174,
        "line": 174,
        "path": "review/ui/components/review-graph/review-graph.js",
        "sha256": "97f7ae46c4e0af9e3ee9603072b38e7aadce6303647b50a6ca494806e3cd4303"
      },
      "to": "class:review/ui/components/review-graph/review-graph.js:ReviewGraph",
      "verb": "handled_by"
    },
    {
      "from": "surface:element:review-ladder",
      "source": {
        "end": 102,
        "line": 102,
        "path": "review/ui/components/review-ladder/review-ladder.js",
        "sha256": "970fbe6a1c63255cdb6c84e4eba3b40803cd48a80db837f4d773386aac49e959"
      },
      "to": "class:review/ui/components/review-ladder/review-ladder.js:ReviewLadder",
      "verb": "handled_by"
    },
    {
      "from": "surface:element:review-node",
      "source": {
        "end": 154,
        "line": 154,
        "path": "review/ui/components/review-node/review-node.js",
        "sha256": "afe69f139074b4321534fe382267cbfe1c71684870e5b1a64169d002919a7b2f"
      },
      "to": "class:review/ui/components/review-node/review-node.js:ReviewNode",
      "verb": "handled_by"
    },
    {
      "from": "surface:element:review-source",
      "source": {
        "end": 95,
        "line": 95,
        "path": "review/ui/components/review-source/review-source.js",
        "sha256": "4b53507f9fa234e2a86d5036d7d42b52fe49b979dfa632c83c86658a796a2a8b"
      },
      "to": "class:review/ui/components/review-source/review-source.js:ReviewSource",
      "verb": "handled_by"
    },
    {
      "from": "surface:element:review-tree",
      "source": {
        "end": 208,
        "line": 208,
        "path": "review/ui/components/review-tree/review-tree.js",
        "sha256": "09d033a10b9334f521552e44613882a8dc9738d37c1acc5437fc735cd792261c"
      },
      "to": "class:review/ui/components/review-tree/review-tree.js:ReviewTree",
      "verb": "handled_by"
    },
    {
      "from": "surface:element:sg-base",
      "source": {
        "end": 118,
        "line": 118,
        "path": "components/sg-base/sg-base.js",
        "sha256": "ba1a7439871dcb9104f0db55ef7557caa9f1bed8d377cd622f44390e5816097f"
      },
      "to": "class:components/sg-base/sg-base.js:SgBase",
      "verb": "handled_by"
    },
    {
      "from": "surface:page:/",
      "source": {
        "end": 253,
        "line": 1,
        "path": "index.html",
        "sha256": "92f82dd94a9114a3df3af56b38a48037503847a308355113f8a4c27e8039386a"
      },
      "to": "surface:element:reader-panel",
      "verb": "exposes"
    },
    {
      "from": "surface:page:/404.html",
      "source": {
        "end": 132,
        "line": 1,
        "path": "404.html",
        "sha256": "ae024148bb8287612e82ca022734f689dd7b444904a95aa92d5d47b4190b91ae"
      },
      "to": "surface:element:reader-panel",
      "verb": "exposes"
    },
    {
      "from": "surface:page:/admin/",
      "source": {
        "end": 188,
        "line": 1,
        "path": "admin/index.html",
        "sha256": "e07115f5170a3e3f53a376091dd05fd9f3dcb25d4db2407e0797e043a66d5bf3"
      },
      "to": "surface:element:reader-panel",
      "verb": "exposes"
    },
    {
      "from": "surface:page:/admin/comms.html",
      "source": {
        "end": 187,
        "line": 1,
        "path": "admin/comms.html",
        "sha256": "a1a37d832bafd67e9f3c6378dac2e23851d3c2519e1dc80a56546ad9e66e782e"
      },
      "to": "surface:element:reader-panel",
      "verb": "exposes"
    },
    {
      "from": "surface:page:/admin/versions.html",
      "source": {
        "end": 148,
        "line": 1,
        "path": "admin/versions.html",
        "sha256": "4a71710645cb68f2390565bb9d0f276a3362bfbbeead8cc9fa55f484a4a84fdb"
      },
      "to": "surface:element:reader-panel",
      "verb": "exposes"
    },
    {
      "from": "surface:page:/components/reader-panel/reader-panel.html",
      "source": {
        "end": 25,
        "line": 1,
        "path": "components/reader-panel/reader-panel.html",
        "sha256": "fc4c772924f9418d6b9278d2e9b3405016695470c2cdfdbb0b81afab3b963812"
      },
      "to": "surface:element:reader-chat",
      "verb": "exposes"
    },
    {
      "from": "surface:page:/components/reader-panel/reader-panel.html",
      "source": {
        "end": 25,
        "line": 1,
        "path": "components/reader-panel/reader-panel.html",
        "sha256": "fc4c772924f9418d6b9278d2e9b3405016695470c2cdfdbb0b81afab3b963812"
      },
      "to": "surface:element:reader-log",
      "verb": "exposes"
    },
    {
      "from": "surface:page:/components/reader-panel/reader-panel.html",
      "source": {
        "end": 25,
        "line": 1,
        "path": "components/reader-panel/reader-panel.html",
        "sha256": "fc4c772924f9418d6b9278d2e9b3405016695470c2cdfdbb0b81afab3b963812"
      },
      "to": "surface:element:review-graph",
      "verb": "exposes"
    },
    {
      "from": "surface:page:/docs/",
      "source": {
        "end": 136,
        "line": 1,
        "path": "docs/index.html",
        "sha256": "45e08a6b39473ef3520eb149bfd45b5a20c5035ec934cb13f3945af673e89d40"
      },
      "to": "surface:element:reader-panel",
      "verb": "exposes"
    },
    {
      "from": "surface:page:/docs/design/",
      "source": {
        "end": 137,
        "line": 1,
        "path": "docs/design/index.html",
        "sha256": "250a48f688f177e5fedf638965622d40b861f6a7d593eaf3c297d7e5db417e5d"
      },
      "to": "surface:element:reader-panel",
      "verb": "exposes"
    },
    {
      "from": "surface:page:/docs/design/brief-corrections.html",
      "source": {
        "end": 199,
        "line": 1,
        "path": "docs/design/brief-corrections.html",
        "sha256": "ebfddef7134fa594b343c19ef25bbbb87b98a5689c0456f39474e02a378468b9"
      },
      "to": "surface:element:reader-panel",
      "verb": "exposes"